[
  {
    "type": "overturo:ready",
    "kind": "consent",
    "version": 2,
    "payload": {
      "kind": "consent",
      "session_token": "CCCCCCCCCCCCCCCCCCCCCCCCCCCCCCCCCCCCCCCCCCC",
      "deadline_at": "2026-06-05T12:01:00.000Z",
      "branding": {
        "application_name": "Demo Co",
        "logo_url": null,
        "primary_color": null
      },
      "mode": "embed",
      "locale": "en-US"
    },
    "ts": "2026-06-05T12:00:00.000Z",
    "message_id": "00000000-0000-4000-8000-000000000020"
  },
  {
    "type": "overturo:deadline",
    "kind": "consent",
    "version": 2,
    "payload": {
      "remaining_seconds": 30,
      "level": "warning",
      "deadline_at": "2026-06-05T12:01:00.000Z"
    },
    "ts": "2026-06-05T12:00:30.000Z",
    "message_id": "00000000-0000-4000-8000-000000000021"
  },
  {
    "type": "overturo:deadline",
    "kind": "consent",
    "version": 2,
    "payload": {
      "remaining_seconds": 15,
      "level": "warning",
      "deadline_at": "2026-06-05T12:01:00.000Z"
    },
    "ts": "2026-06-05T12:00:45.000Z",
    "message_id": "00000000-0000-4000-8000-000000000022"
  },
  {
    "type": "overturo:complete",
    "kind": "consent",
    "version": 2,
    "payload": {
      "outcome": "granted",
      "exchange_token": "ctx_under_deadline",
      "completed_at": "2026-06-05T12:00:50.000Z"
    },
    "ts": "2026-06-05T12:00:50.001Z",
    "message_id": "00000000-0000-4000-8000-000000000023"
  }
]
